{
  "$schema": "http://json-schema.org/draft-07/schema#",
  "$id": "https://github.com/your-org/mailsite-agent/clients.schema.json",
  "title": "mailsite-agent configuration",
  "type": "object",
  "required": ["mail", "updateAddress", "developerEmail", "clients"],
  "additionalProperties": false,
  "properties": {
    "mail": {
      "type": "object",
      "required": ["read"],
      "additionalProperties": false,
      "description": "Mail providers. `read` must be pollable; `send` defaults to `read`.",
      "properties": {
        "read": {
          "type": "string",
          "enum": ["gmail", "imap", "claude-connector"],
          "description": "Inbound provider (must support polling). imap covers ProtonMail-via-Bridge, Fastmail, etc."
        },
        "send": {
          "type": "string",
          "enum": ["gmail", "imap", "resend", "claude-connector"],
          "description": "Outbound provider for replies. Omit to reuse `read`."
        }
      }
    },
    "imap": {
      "type": "object",
      "description": "Non-secret IMAP/SMTP settings (credentials go in .env).",
      "additionalProperties": true
    },
    "resend": {
      "type": "object",
      "additionalProperties": false,
      "properties": {
        "from": {
          "type": "string",
          "description": "Verified Resend sender, e.g. \"Updates <updates@you.com>\"."
        }
      }
    },
    "updateAddress": {
      "type": "string",
      "format": "email",
      "description": "The inbox/address owners send change requests to."
    },
    "developerEmail": {
      "type": "string",
      "format": "email",
      "description": "Gets NeedsHuman alerts when a run cannot proceed safely."
    },
    "labelPrefix": {
      "type": "string",
      "default": "WebUpdate",
      "description": "Namespace for the state labels (e.g. WebUpdate/InProgress)."
    },
    "clients": {
      "type": "array",
      "minItems": 1,
      "items": { "$ref": "#/definitions/client" }
    }
  },
  "definitions": {
    "client": {
      "type": "object",
      "required": [
        "id", "name", "authorizedSenders", "secretWord",
        "repoPath", "productionBranch", "netlifySiteName", "netlifySiteId"
      ],
      "additionalProperties": false,
      "properties": {
        "id": {
          "type": "string",
          "pattern": "^[a-z0-9][a-z0-9-]*$",
          "description": "Stable slug; also the sites/<id> directory name."
        },
        "name": { "type": "string" },
        "authorizedSenders": {
          "type": "array",
          "minItems": 1,
          "items": { "type": "string", "format": "email" },
          "description": "Only these From addresses may request changes."
        },
        "secretWord": {
          "type": "string",
          "minLength": 6,
          "description": "Must appear in the email body. Defeats simple From spoofing."
        },
        "repoPath": {
          "type": "string",
          "description": "Path to the local clone, relative to the hub root."
        },
        "productionBranch": { "type": "string", "default": "main" },
        "hosting": {
          "type": "object",
          "description": "Which host this site deploys to, and its settings.",
          "required": ["provider"],
          "additionalProperties": false,
          "properties": {
            "provider": {
              "type": "string",
              "enum": ["netlify", "cloudflare"],
              "description": "Hosting provider. Deploys are triggered by git push; the deploy port observes state and resolves URLs."
            },
            "netlify": {
              "type": "object",
              "additionalProperties": false,
              "properties": {
                "siteName": { "type": "string", "description": "Used to build the deploy-preview URL." },
                "siteId": { "type": "string", "description": "Netlify site API ID, used to poll deploy state." }
              }
            },
            "cloudflare": {
              "type": "object",
              "additionalProperties": false,
              "properties": {
                "projectName": { "type": "string", "description": "Cloudflare Pages project name." },
                "accountId": { "type": "string", "description": "Account ID (or set CLOUDFLARE_ACCOUNT_ID in .env)." }
              }
            }
          }
        },
        "netlifySiteName": {
          "type": "string",
          "description": "Deprecated: use hosting.netlify.siteName. Kept for backward compatibility."
        },
        "netlifySiteId": {
          "type": "string",
          "description": "Deprecated: use hosting.netlify.siteId. Kept for backward compatibility."
        },
        "replyTo": {
          "type": "string",
          "format": "email",
          "description": "Override where confirmations go (defaults to sender)."
        },
        "assetDirHint": {
          "type": "string",
          "description": "Optional: where images live in the repo (e.g. assets/img)."
        }
      }
    }
  }
}
